<?xml version="1.0" encoding="UTF-8"?>
<!-- edited with XMLSpy v2008 rel. 2 (http://www.altova.com) by mazuki (darksiderg) -->
<!--W3C Schema generated by XMLSpy v2008 rel. 2 (http://www.altova.com)-->
<xs:schema xmlns:xs="http://www.w3.org/2001/XMLSchema">
	<xs:element name="initial-cash" type="xs:int"/>
	<xs:element name="id" type="xs:int"/>
	<xs:element name="event">
		<xs:complexType>
			<xs:attribute name="id" type="xs:int" use="required"/>
		</xs:complexType>
	</xs:element>
	<xs:element name="description" type="xs:string"/>
	<xs:element name="comision">
		<xs:complexType>
			<xs:simpleContent>
				<xs:extension base="xs:int">
					<xs:attribute name="type" use="required">
						<xs:simpleType>
							<xs:restriction base="xs:string">
								<xs:enumeration value="on-close"/>
								<xs:enumeration value="on-purchase"/>
							</xs:restriction>
						</xs:simpleType>
					</xs:attribute>
				</xs:extension>
			</xs:simpleContent>
		</xs:complexType>
	</xs:element>
	<xs:element name="b" type="xs:int"/>
	<xs:element name="Guess-Market">
		<xs:complexType>
			<xs:all>
				<xs:element ref="GM-events"/>
				<xs:element ref="GM-users"/>
			</xs:all>
		</xs:complexType>
	</xs:element>
	<xs:element name="GM-users">
		<xs:complexType>
			<xs:sequence>
				<xs:element ref="GM-user" maxOccurs="unbounded"/>
			</xs:sequence>
		</xs:complexType>
	</xs:element>
	<xs:element name="GM-user">
		<xs:complexType>
			<xs:sequence>
				<xs:element ref="initial-cash"/>
				<xs:element ref="GM-mareket-maker" minOccurs="0"/>
			</xs:sequence>
			<xs:attribute name="name" type="xs:string" use="required"/>
		</xs:complexType>
	</xs:element>
	<xs:element name="GM-order-book">
		<xs:complexType>
			<xs:attribute name="inital" type="xs:int" use="required"/>
			<xs:attribute name="d" type="xs:int" use="required"/>
			<xs:attribute name="allow-mint" use="required">
				<xs:simpleType>
					<xs:restriction base="xs:string">
						<xs:enumeration value="false"/>
						<xs:enumeration value="true"/>
					</xs:restriction>
				</xs:simpleType>
			</xs:attribute>
		</xs:complexType>
	</xs:element>
	<xs:element name="GM-options">
		<xs:complexType>
			<xs:sequence>
				<xs:element ref="GM-option" maxOccurs="2"/>
			</xs:sequence>
		</xs:complexType>
	</xs:element>
	<xs:element name="GM-option" type="xs:string"/>
	<xs:element name="GM-method">
		<xs:complexType>
			<xs:choice>
				<xs:element ref="GM-LMSR"/>
				<xs:element ref="GM-order-book"/>
			</xs:choice>
		</xs:complexType>
	</xs:element>
	<xs:element name="GM-mareket-maker">
		<xs:complexType>
			<xs:sequence>
				<xs:element ref="event" maxOccurs="unbounded"/>
			</xs:sequence>
		</xs:complexType>
	</xs:element>
	<xs:element name="GM-events">
		<xs:complexType>
			<xs:sequence>
				<xs:element ref="GM-event" maxOccurs="unbounded"/>
			</xs:sequence>
		</xs:complexType>
	</xs:element>
	<xs:element name="GM-event">
		<xs:complexType>
			<xs:sequence>
				<xs:element ref="id"/>
				<xs:element ref="description"/>
				<xs:element ref="comision"/>
				<xs:element ref="GM-options"/>
				<xs:element ref="GM-method"/>
			</xs:sequence>
			<xs:attribute name="name" type="xs:string" use="required"/>
		</xs:complexType>
	</xs:element>
	<xs:element name="GM-LMSR">
		<xs:complexType>
			<xs:sequence>
				<xs:element ref="b"/>
			</xs:sequence>
		</xs:complexType>
	</xs:element>
</xs:schema>
